{
  "schema": "ku2d.acquisition-experience.v1",
  "experience_id": "KU2D-X-000001",
  "generated_at": "2026-09-01T11:15:38.6811437+07:00",
  "source": {
    "domain": "Q-Diving",
    "source_type": "public_video_metadata",
    "provider": "YouTube Data API v3",
    "access_surface": "official_metadata_api"
  },
  "goal": "Discover bounded public Q-Diving video and channel identity candidates for later Human Review without approving or acquiring content.",
  "attempt": {
    "method": "immutable two-checkout workflow with staged authorization validation and sanitized evidence-before-exit",
    "techniques": [
      "bounded first-page search.list discovery",
      "batched videos.list metadata enrichment",
      "offline exact-scope authorization validation",
      "sanitized artifact availability guard"
    ],
    "bounded_scope": {
      "profiles": [
        "QYT-BEGINNER-KOH-TAO-TH",
        "QYT-BEGINNER-EN"
      ],
      "max_results_per_profile": 5,
      "max_pages_per_profile": 1,
      "max_search_list_requests": 2,
      "max_videos_list_requests": 1,
      "max_documented_quota_units_per_dispatch": 201,
      "comments_acquired": false,
      "captions_called": false,
      "transcript_text_acquired": false,
      "production_store": false
    },
    "provider_reached": true,
    "effort_class": "high"
  },
  "outcome": {
    "status": "blocked",
    "failure_stage": "coordination_protocol_preflight",
    "failure_code": "historical_append_only_record_rejected_by_full_bundle_validator",
    "record_counts": {
      "authorized_dispatches_observed": 2,
      "provider_reached_dispatches": 1,
      "preprovider_failed_dispatches": 1,
      "candidate_count": null,
      "usable_reviewed_identity_count": 0,
      "sanitized_artifact_count": 0
    },
    "quality": {
      "useful_rate": null,
      "mean_quality": null,
      "completeness": null
    },
    "documented_quota_units": null
  },
  "evidence": {
    "result_ids": [
      "KU2D-R-000043",
      "KU2D-R-000047",
      "KU2D-R-000048",
      "KU2D-R-000049"
    ],
    "provenance_refs": [
      "KU2D-V-000048",
      "main:769149377b9a7886ae2fc6457c7fe815a09d5cd6",
      "execution:cac243aedaa3c83c188e4e90481e4b752fe8bd2b",
      "workflow-run:33463297483",
      "workflow-run:33467010248"
    ],
    "artifact_refs": [],
    "sanitized": true
  },
  "learning": {
    "reusable_pattern": "Validate the full authority bundle and exact immutable scope offline, execute the literal artifact guard contract, and only then permit a bounded runtime secret step.",
    "reusable_lesson": "Artifact preservation and acquisition authorization are separate fail-closed gates. Test both before remote mutation, and validate every append-only coordination record against the active protocol so a later canonical record cannot conceal an earlier incompatible record.",
    "next_strategy": "Define an append-only protocol migration or historical-record compatibility rule before any additional identity-discovery dispatch; do not rewrite historical authority records or infer missing runtime quality.",
    "labels": [
      "artifact-guard",
      "authorization-preflight",
      "coordination-provenance",
      "fail-closed",
      "identity-discovery",
      "preprovider-failure",
      "q-diving",
      "youtube"
    ]
  },
  "safety": {
    "contains_secret": false,
    "contains_raw_payload": false,
    "contains_personal_data": false,
    "production_authorized": false
  }
}
